<peerInfo
    xmlns="peerInfo"
    xmlns:xsi="http://www.w3.org/2001/XMLSchema-instance"
    xsi:schemaLocation="peerInfo validation/peerInfo.xsd">
    <attributes>
        <attribute name="reboot.usr.ssh">test</attribute>
        <attribute name="reboot.psw.ssh">test</attribute>
        <attribute name="reboot.port.ssh">2022</attribute>
        <attribute name="reboot.cmd.ssh">reboot me please</attribute>
        <attribute name="reboot.usr.pwr">test-pwd</attribute>
        <attribute name="reboot.psw.pwr">test-pwd</attribute>
        <attribute name="reboot.host.pwr">127.0.0.1</attribute>
        <attribute name="reboot.port.pwr">2024</attribute>
        <attribute name="reboot.cmd.pwr">reboot me now</attribute>
    </attributes>
</peerInfo>