<peerInfo
    xmlns="peerInfo"
    xmlns:xsi="http://www.w3.org/2001/XMLSchema-instance"
    xsi:schemaLocation="peerInfo validation/peerInfo.xsd">
    <attributes>
        <attribute name="reboot.usr.pwr">test-pwr</attribute>
        <attribute name="reboot.psw.pwr">test-pwr</attribute>
        <attribute name="reboot.host.pwr">127.0.0.1</attribute>
        <attribute name="reboot.port.pwr">2024</attribute>
        <attribute name="reboot.cmd.pwr">power off port 1</attribute>
        <attribute name="reboot.quit.pwr">QUIT</attribute>
    </attributes>
</peerInfo>